<?xml version="1.0" encoding="UTF-8"?><people xmlns:xsi="http://www.w3.org/2001/XMLSchema-instance" xsi:noNamespaceSchemaLocation="Y:\Data\SourceCode\XML\people_1.xsd">	<person>		<name>Rothlin</name>		<firstname>Walter</firstname>		<plz>8855</plz>		<city/>		<phone/>		<pet species="dog">Fido</pet>	</person>	<person>		<name>Rothlin</name>		<firstname>Max</firstname>		<plz>8855</plz>		<city/>		<phone/>		<pet species="cat">Bussy</pet>	</person></people>